{
  "page-type": "module",
  "module-type": "realtime",
  "title": "Real-time usage",
  "description": "Live number of users on GOV.UK",
  "info": [
    "Data source: Google Analytics",
    "Shows the estimated number of users currently accessing GOV.UK."
  ],
  "dashboard-title": "Activity on GOV.UK",
  "dashboard-strapline": "Performance",
  "dashboard-slug": "gov-uk",
  "data-group": "government",
  "data-type": "realtime"
}
